<?xml version="1.0"?>
<macker xmlns:xsi="http://www.w3.org/2001/XMLSchema-instance" xsi:noNamespaceSchemaLocation="macker.xsd">
    <ruleset name="Internal package may only be referenced by parent package">
        <foreach var="module" class="(**).internal.**">
            <pattern name="parent" class="${module}.**"/>
            <pattern name="inside" class="${module}.internal.**"/>
            <pattern name="outside">
                <exclude pattern="inside"/>
            </pattern>

            <access-rule>
                <message>${from-full} cannot access internal classes from ${module}</message>
                <deny>
                    <from pattern="outside"/>
                    <to pattern="inside"/>
                    <allow>
                        <from pattern="parent"/>
                    </allow>
                </deny>
            </access-rule>
        </foreach>
    </ruleset>
</macker>
